"team_member","role","skills","sprint_1_hours","sprint_1_utilization","sprint_1_tasks","sprint_2_hours","sprint_2_utilization","sprint_2_tasks","total_allocated_hours","capacity_buffer","collaboration_time","learning_objectives","risk_factors","backup_resources","cross_training_opportunities"
"fe.dev.1@company.com","Frontend Developer","React,TypeScript,Cypress,Material-UI","45","70%","T001,T002,T003,T004,T034","50","78%","T015,T016,T010,T011","95","25%","15%","Mastering service worker implementation.","Key person dependency for UI implementation.","fe.dev.2@company.com",""
"fe.dev.2@company.com","Senior Frontend Developer","React,Redux,OAuth,Accessibility,System Design","55","86%","T005,T006,T007,T008,T009","55.9","87%","T019,T020,T021,T023","110.9","14%","20%","Deep dive into secure OAuth 2.0 PKCE flow implementation.","Complexity of OAuth and offline sync design.","tech.lead@company.com","Mentor fe.dev.1 on advanced state management."
"be.dev.1@company.com","Backend Developer","NestJS,TypeORM,PostgreSQL,REST APIs","54","84%","T022,T037,T029,T030","","0%","","54","16%","15%","Focus on security best practices for JWT handling and database transactions.","Potential for authorization flaws (RISK-007).","be.dev.2@company.com",""
"be.dev.2@company.com","Senior Backend Developer","NestJS,AWS Lambda,Security,System Architecture","25","39%","T089,T018","","0%","","25","61%","20%","Design and implement a secure code execution sandbox (RISK-002).","High complexity and security risk of the formula execution Lambda.","tech.lead@company.com","Lead security reviews for all backend services."
"devops.eng@company.com","DevOps Engineer","Terraform,AWS,CI/CD,GitHub Actions","10.3","16%","T014","","0%","","10.3","84%","25%","Design and implement Blue/Green deployment strategy (RISK-004).","Complexity of deployment automation.","",""