"task_id","task_name","primary_skill","secondary_skills","complexity_level","estimated_hours","required_experience","productivity_factor","adjusted_hours","team_size","collaboration_required","dependencies","critical_path","skill_learning_curve","ramp_up_hours","resource_notes","alternative_approach","risk_factors","mitigation_strategy","quality_overhead","review_hours","documentation_hours","testing_coordination","integration_overhead"
"T002","FE-Impl: Develop MainLayout component with responsive structure","React","TypeScript,Material-UI,Responsive Design","Medium","8.3","Mid","1","8.3","1","","T001","true","Low","1","Core layout component, requires strong understanding of Material-UI responsive hooks.","Could be assigned to a senior dev for faster completion, but is a good task for a mid-level.","Incorrect implementation will affect all subsequent UI stories.","Thorough code review by Frontend Lead.","1.25","0.83","0.42","2","1"
"T022","BE-Impl: Implement JWT authentication guard and strategy","NestJS","Security,JWT,Passport.js","Medium","12.3","Senior","1.2","10.25","1","true","T014","true","Low","2","Security-critical component. Requires deep understanding of JWT validation against a JWKS endpoint.","None. Must be done by an experienced backend developer.","RISK-007: Improper implementation could lead to major security vulnerabilities.","Mandatory security code review by Tech Lead and Security Team.","1.85","1.23","0.62","3","2"
"T020","FE-Impl: Develop Login UI and integrate with Cognito OAuth flow","React","OAuth 2.0,Security,AWS Amplify","High","14.3","Senior","1.2","11.92","1","true","T019","true","Medium","4","Requires expertise in OAuth 2.0 PKCE flow for SPAs. Security is paramount.","Could be split between two developers (UI vs. logic), but a single owner is preferred for security consistency.","Incorrect token handling can lead to XSS or other session vulnerabilities.","Follow industry best practices for SPA token management. Security review is mandatory.","2.15","1.43","0.72","4","3"
"T044","BE-Impl: Implement Secure Formula Execution Lambda with isolated-vm","AWS Lambda","Security,Node.js,isolated-vm","High","20.7","Senior","1.2","17.25","1","true","","true","High","8","Highest security risk task. Requires a developer with deep knowledge of Node.js VMs and security sandboxing.","Engage a security contractor specializing in this area.","RISK-002: A sandbox escape vulnerability would be critical.","Rigorous security code review, penetration testing, and minimal privilege IAM role.","3.11","2.07","1.04","5","4"
"T041","FE-Impl: Develop wizard step 3 (Define Formulas) with validation","React","Parsing Libraries,Code Editor Integration","High","20.7","Senior","1.2","17.25","1","","T040","true","Medium","4","Complex state management for real-time validation and integration of a code editor.","Simplify to basic textarea without syntax highlighting if time is constrained, but with high UX penalty.","Performance issues with real-time parsing on every keystroke.","Implement debouncing on the validation logic. Choose a lightweight parsing library.","3.11","2.07","1.04","4","3"
"T027","FE-Impl: Develop background synchronization and conflict resolution logic","TypeScript","IndexedDB,Async Programming","High","20.7","Senior","1.2","17.25","1","true","T026,T024","true","High","8","High risk of data loss if not implemented correctly. Requires extensive testing of edge cases.","Use a third-party library like PouchDB or RxDB to handle sync, but this adds a large dependency.","RISK-001: Data loss or corruption due to flaws in sync logic.","Extensive E2E testing with network manipulation. Pair programming on critical logic.","3.11","2.07","1.04","6","4"