"role","primary_skills","experience_level","capacity_hours_per_sprint","productivity_factor","effective_capacity","tasks_assigned","total_allocated_hours","utilization_percentage","buffer_hours","mentoring_capacity","code_review_hours","cross_training_hours","availability_constraints","skill_development_goals","backup_resources","risk_mitigation","cost_per_hour","total_cost","alternative_allocation"
"Lead Frontend Developer","React,TypeScript,Architecture,Redux","Lead","64","1.3","83.2","[""TASK-001-01"",""TASK-001-02"",""TASK-007-01"",""TASK-007-02"",""TASK-012-02"",""TASK-020-02"",""TASK-020-03"",""TASK-041-02"",""TASK-060-02"",""TASK-060-03"",""TASK-060-04""]","100","31.25","220","12.8","9.6","6.4","Available full-time","Mastery of Service Workers and `isolated-vm` security principles.","frontend.dev2@company.com","Key person dependency for parser and offline sync. Mitigation: Pair programming on these critical tasks.","100","10000","Can absorb additional UI tasks if backend work is delayed."
"Frontend Developer","React,TypeScript,Material-UI,Accessibility","Mid","64","1","64","[""TASK-052-02"",""TASK-052-03"",""TASK-053-02"",""TASK-027-01"",""TASK-027-02"",""TASK-053-03"",""TASK-037-02"",""TASK-037-03"",""TASK-063-02""]","86.8","27.13","233.2","6.4","6.4","9.6","Available full-time","Advanced accessibility remediation, OAuth 2.0 security patterns.","frontend.dev1@company.com","Lead the accessibility hardening sprint to build expertise.","80","6944","Can take on more component development tasks from Lead FE."
"Lead Backend Developer","NestJS,PostgreSQL,Security,AWS Lambda","Senior","64","1.2","76.8","[""TASK-053-01"",""TASK-012-01"",""TASK-020-01"",""TASK-041-01"",""TASK-047-02"",""TASK-071-03""]","97","30.31","223","12.8","9.6","6.4","Available full-time","Deep expertise in secure sandbox design with `isolated-vm`.","External Security Consultant","Key person dependency for all security-critical backend tasks. Mitigation: Extensive documentation and knowledge sharing sessions.","100","9700","Can be augmented with a contractor for Sprint 3 to accelerate custom mode work."
"DevOps Engineer","Terraform,AWS,CI/CD,GitHub Actions","Mid","64","1.1","70.4","[""TASK-052-01"",""TASK-047-01"",""TASK-071-01"",""TASK-063-01""]","27.2","8.5","292.8","","6.4","3.2","Part-time on project, 50% allocation.","Secure Lambda provisioning patterns, Blue/Green deployment scripting.","backend.dev1@company.com (basic Terraform)","Single point of failure for all infrastructure. Mitigation: Pair with backend dev on IaC for key services.","90","2448","Available for operational support and CI/CD maintenance."
"QA Engineer","Cypress,E2E Testing,Accessibility Testing","Mid","64","1","64","[""TASK-052-04"",""TASK-063-03""]","22.7","7.09","297.3","","3.2","6.4","Available full-time","Formalizing manual accessibility audit process and integrating with automated tools.","None","QA is a bottleneck. Mitigation: Empower developers to write more E2E tests and perform initial accessibility checks.","70","1589","Can allocate more time to exploratory testing and test plan creation."