"dependency_id","from_task","to_task","dependency_type","description","critical_path","lead_time_days","responsible_team","coordination_required","risk_level","mitigation_plan","status","resolution_date","impact_if_delayed","escalation_required"
"DEP-001","B-TSK-001","B-TSK-002","Technical","Database connection module requires the base NestJS project structure.","true","","Backend Team","","Low","Task is sequential and assigned to the same developer.","Active","","Cascading delay across all database-dependent tasks.",""
"DEP-002","B-TSK-006","B-TSK-007","Technical","The global `JwtAuthGuard` cannot be implemented without the underlying `JwtStrategy`.","true","","Backend Team","","Low","Task is sequential and assigned to the same developer.","Active","","Delays all API endpoint security implementation.",""
"DEP-003","B-TSK-009","B-TSK-010","Technical","On-demand user creation in the database requires the `users` table to exist via migration.","true","","Backend Team","","Low","Task is sequential and assigned to the same developer.","Active","","Blocks implementation of all user-scoped APIs.",""
"DEP-004","B-TSK-029","B-TSK-030","Technical","The sandbox execution logic cannot be written until the `isolated-vm` library is successfully set up and deployable within the Lambda environment.","true","1","Backend Team","true","High","A technical spike was performed (implicitly by pulling into Sprint 1). Ample buffer time is allocated in the sprint plan.","Active","","Delays the entire custom mode execution feature.",""
"DEP-005","B-TSK-030","B-TSK-034","Technical","The API endpoint for executing a custom formula cannot be fully implemented until the target Lambda function exists to be invoked.","true","","Backend Team","true","Medium","Define the Lambda's event payload (API contract) early, allowing the NestJS service to be developed against a mocked Lambda interface.","Active","","Blocks the core functionality of the custom modes feature.",""
"DEP-006","B-TSK-026","B-TSK-027","Technical","Conflict resolution logic must be built on top of the batch update endpoint.","","","Backend Team","","Medium","Tasks are sequential and assigned to the same developer.","Active","","The offline sync feature would be incomplete and prone to data corruption.",""